[
  {
    "actor_term_local": "provider of a general-purpose AI model",
    "actor_type": "market_provider",
    "additional_authority": "competent national authorities",
    "adoption_status": "adopted",
    "applicability_status": "applicable",
    "claim_id": "EU-01",
    "claim_origin": "parent_record",
    "claim_record_type": "obligation",
    "compliance_function": "direct_obligation",
    "conduct_term_local": "draw up and maintain technical documentation, including training, testing and evaluation results\n",
    "conduct_type": "evaluation_documentation",
    "enforcement_status": "unknown",
    "headline_relevance": "supporting_only",
    "implementation_body": "AI Office",
    "instrument": "EU_AI_ACT",
    "interpretation_note": "The provision requires documentation that includes evaluation results but does not independently create a direct duty to perform model evaluation.\n",
    "jurisdiction": "EU",
    "legal_force": "binding",
    "parent_row_id": "EU-01",
    "parser_version": "eu-us-ai-evaluation-pilot@1.0.0",
    "record_type": "pilot_normalized_claim",
    "responsible_authority": "European Commission",
    "schema_version": "1.0.0",
    "scope": [
      "cross_sector"
    ],
    "source_locator": "Article 53(1)(a)",
    "target_system": "general_purpose_ai_model"
  },
  {
    "actor_term_local": "provider of a general-purpose AI model",
    "actor_type": "market_provider",
    "additional_authority": "competent national authorities",
    "adoption_status": "adopted",
    "applicability_status": "applicable",
    "claim_id": "EU-02",
    "claim_origin": "parent_record",
    "claim_record_type": "obligation",
    "compliance_function": "direct_obligation",
    "conduct_term_local": "provide information and documentation to downstream artificial-intelligence system providers\n",
    "conduct_type": "downstream_documentation",
    "enforcement_status": "unknown",
    "headline_relevance": "supporting_only",
    "implementation_body": "AI Office",
    "instrument": "EU_AI_ACT",
    "interpretation_note": "This is a binding information and documentation obligation for downstream integration. It may support evaluation and oversight but does not itself require the GPAI provider to perform model evaluation.\n",
    "jurisdiction": "EU",
    "legal_force": "binding",
    "parent_row_id": "EU-02",
    "parser_version": "eu-us-ai-evaluation-pilot@1.0.0",
    "recipient_actor_term_local": "provider intending to integrate the general-purpose AI model into an artificial-intelligence system\n",
    "recipient_actor_type": "downstream_provider",
    "record_type": "pilot_normalized_claim",
    "responsible_authority": "European Commission",
    "schema_version": "1.0.0",
    "scope": [
      "cross_sector"
    ],
    "source_locator": "Article 53(1)(b)",
    "target_system": "general_purpose_ai_model"
  },
  {
    "actor_term_local": "provider of a general-purpose AI model",
    "actor_type": "market_provider",
    "additional_authority": "competent national authorities",
    "adoption_status": "adopted",
    "applicability_status": "applicable",
    "claim_id": "EU-03",
    "claim_origin": "parent_record",
    "claim_record_type": "obligation",
    "compliance_function": "direct_obligation",
    "conduct_term_local": "put in place a policy to comply with Union copyright law\n",
    "conduct_type": "copyright_policy",
    "enforcement_status": "unknown",
    "headline_relevance": "contextual_only",
    "implementation_body": "AI Office",
    "instrument": "EU_AI_ACT",
    "interpretation_note": "This is a binding copyright-compliance policy obligation. It does not require model evaluation, testing or risk assessment.\n",
    "jurisdiction": "EU",
    "legal_force": "binding",
    "parent_row_id": "EU-03",
    "parser_version": "eu-us-ai-evaluation-pilot@1.0.0",
    "record_type": "pilot_normalized_claim",
    "responsible_authority": "European Commission",
    "schema_version": "1.0.0",
    "scope": [
      "cross_sector"
    ],
    "source_locator": "Article 53(1)(c)",
    "target_system": "general_purpose_ai_model"
  },
  {
    "actor_term_local": "provider of a general-purpose AI model",
    "actor_type": "market_provider",
    "adoption_status": "adopted",
    "applicability_status": "applicable",
    "claim_id": "EU-04",
    "claim_origin": "parent_record",
    "claim_record_type": "obligation",
    "compliance_function": "direct_obligation",
    "conduct_term_local": "draw up and make publicly available a sufficiently detailed summary of the content used to train the model\n",
    "conduct_type": "training_content_summary",
    "enforcement_status": "unknown",
    "headline_relevance": "contextual_only",
    "implementation_body": "AI Office",
    "instrument": "EU_AI_ACT",
    "interpretation_note": "This is a binding public-transparency obligation concerning training content. It does not require model evaluation, testing or risk assessment.\n",
    "jurisdiction": "EU",
    "legal_force": "binding",
    "parent_row_id": "EU-04",
    "parser_version": "eu-us-ai-evaluation-pilot@1.0.0",
    "record_type": "pilot_normalized_claim",
    "responsible_authority": "European Commission",
    "schema_version": "1.0.0",
    "scope": [
      "cross_sector"
    ],
    "source_locator": "Article 53(1)(d)",
    "target_system": "general_purpose_ai_model"
  },
  {
    "actor_term_local": "open-source general-purpose AI model provider",
    "actor_type": "market_provider",
    "adoption_status": "adopted",
    "applicability_status": "applicable",
    "claim_id": "EU-05",
    "claim_origin": "parent_record",
    "claim_record_type": "exception_rule",
    "compliance_function": "obligation_exception",
    "defined_actor_class": "open_source_gpai_provider",
    "enforcement_status": "unknown",
    "exception_conditions_status": "statutory conditions apply but are not fully encoded from the uploaded annotation table\n",
    "exception_scope_local": "possible exemption from some Article 53 documentation obligations\n",
    "exception_target": [
      "specified_Article_53_documentation_obligations"
    ],
    "headline_relevance": "qualifies_baseline_obligations",
    "implementation_body": "AI Office",
    "instrument": "EU_AI_ACT",
    "interpretation_note": "Article 53(2) provides a conditional exception from specified Article 53 documentation obligations for qualifying open-source GPAI providers. It does not create a general exemption from the AI Act or erase every obligation that may apply.\n",
    "jurisdiction": "EU",
    "legal_force": "binding",
    "parent_row_id": "EU-05",
    "parser_version": "eu-us-ai-evaluation-pilot@1.0.0",
    "record_type": "pilot_normalized_claim",
    "responsible_authority": "European Commission",
    "schema_version": "1.0.0",
    "scope": [
      "cross_sector"
    ],
    "source_legal_force_label": "binding_exception",
    "source_locator": "Article 53(2)",
    "target_system": "open_source_general_purpose_ai_model"
  },
  {
    "actor_term_local": "provider of a general-purpose AI model with systemic risk\n",
    "actor_type": "market_provider",
    "adoption_status": "adopted",
    "applicability_status": "applicable",
    "claim_id": "EU-06",
    "claim_origin": "parent_record",
    "claim_record_type": "obligation",
    "compliance_function": "direct_obligation",
    "conduct_term_local": "perform model evaluation using standardized protocols and state-of-the-art tools, including adversarial testing\n",
    "conduct_type": "model_evaluation",
    "enforcement_status": "unknown",
    "headline_relevance": "directly_satisfies_for_defined_class",
    "implementation_body": "AI Office",
    "instrument": "EU_AI_ACT",
    "interpretation_note": "This is the clearest EU positive example of a binding and currently applicable model-evaluation duty for a defined class of market providers.\n",
    "jurisdiction": "EU",
    "legal_force": "binding",
    "parent_row_id": "EU-06",
    "parser_version": "eu-us-ai-evaluation-pilot@1.0.0",
    "record_type": "pilot_normalized_claim",
    "responsible_authority": "European Commission",
    "schema_version": "1.0.0",
    "source_locator": "Article 55(1)(a)",
    "target_system": "general_purpose_ai_model_with_systemic_risk"
  },
  {
    "actor_term_local": "provider of a general-purpose AI model with systemic risk\n",
    "actor_type": "market_provider",
    "adoption_status": "adopted",
    "applicability_status": "applicable",
    "claim_id": "EU-07",
    "claim_origin": "parent_record",
    "claim_record_type": "obligation",
    "compliance_function": "direct_obligation",
    "conduct_term_local": "assess possible systemic risks at Union level\n",
    "conduct_type": "risk_assessment",
    "enforcement_status": "unknown",
    "headline_relevance": "supporting_only",
    "implementation_body": "AI Office",
    "instrument": "EU_AI_ACT",
    "interpretation_note": "The systemic-risk assessment obligation supports evaluation governance but remains distinct from the direct model-evaluation duty.\n",
    "jurisdiction": "EU",
    "legal_force": "binding",
    "parent_row_id": "EU-07",
    "parser_version": "eu-us-ai-evaluation-pilot@1.0.0",
    "record_type": "pilot_normalized_claim",
    "responsible_authority": "European Commission",
    "schema_version": "1.0.0",
    "source_locator": "Article 55(1)(b)",
    "target_system": "general_purpose_ai_model_with_systemic_risk"
  },
  {
    "actor_term_local": "provider of a general-purpose AI model with systemic risk\n",
    "actor_type": "market_provider",
    "additional_authority": "national competent authorities, where appropriate\n",
    "adoption_status": "adopted",
    "applicability_status": "applicable",
    "claim_id": "EU-08",
    "claim_origin": "parent_record",
    "claim_record_type": "obligation",
    "compliance_function": "direct_obligation",
    "conduct_term_local": "report relevant information about serious incidents and possible corrective measures\n",